http://www.runoob.com/sqlite/sqlite-tutorial.html
http://www.w3school.com.cn/sql/sql_syntax.asp

SQL 语句对大小写不敏感。SELECT 等效于 select
但也有一些命令是大小写敏感的，比如 GLOB 和 glob 在 SQLite 的语句中有不同的含义
===================================
DDL - 数据定义语言
CREATE	创建一个新的表，一个表的视图，或者数据库中的其他对象。
ALTER	修改数据库中的某个已有的数据库对象，比如一个表。
DROP	删除整个表，或者表的视图，或者数据库中的其他对象。

DML - 数据操作语言
INSERT	创建一条记录。
UPDATE	修改记录。
DELETE	删除记录。

DQL - 数据查询语言
SELECT	从一个或多个表中检索某些记录。

===================================SQLite 命令行命令
http://www.runoob.com/sqlite/sqlite-commands.html

===================================数据类型
NULL	值是一个 NULL 值。
INTEGER	值是一个带符号的整数，根据值的大小存储在 1、2、3、4、6 或 8 字节中。
REAL	值是一个浮点值，存储为 8 字节的 IEEE 浮点数字。
TEXT	值是一个文本字符串，使用数据库编码（UTF-8、UTF-16BE 或 UTF-16LE）存储。
BLOB	值是一个 blob 数据，完全根据它的输入存储。

SQLite 没有单独的 Boolean 存储类。相反，布尔值被存储为整数 0（false）和 1（true）。

Date 与 Time 数据类型
SQLite 没有一个单独的用于存储日期和/或时间的存储类，但 SQLite 能够把日期和时间存储为 TEXT、REAL 或 INTEGER 值。
存储类	日期格式
TEXT	格式为 "YYYY-MM-DD HH:MM:SS.SSS" 的日期。
REAL	从公元前 4714 年 11 月 24 日格林尼治时间的正午开始算起的天数。
INTEGER	从 1970-01-01 00:00:00 UTC 算起的秒数。

--------------------------##########--------------------------
===================================创建数据库
$sqlite3 testDB.db
上面的命令将在当前目录下创建一个文件 testDB.db。该文件将被 SQLite 引擎用作数据库。
 .databases 或者.database 命令来检查它是否在数据库列表中
 .quit 命令退出 sqlite 提示符

 .dump 点命令来导出完整的数据库在一个文本文件中，如下所示：
$sqlite3 testDB.db .dump > testDB.sql
从生成的 testDB.sql 恢复，如下所示：
$sqlite3 testDB.db < testDB.sql

===================================附加数据库
ATTACH DATABASE 'DatabaseName' As 'Alias-Name';
###数据库名称 main 和 temp 被保留用于主数据库和存储临时表及其他临时数据对象的数据库。###
如果数据库尚未被创建，上面的命令将创建一个数据库，如果数据库已存在，则把数据库文件名称与逻辑数据库 'Alias-Name' 绑定在一起。
sqlite> ATTACH DATABASE 'testDB.db' as 'TEST'; // Enter SQL statements terminated with a ";"

===================================分离数据库
DETACH DATABASE 'Alias-Name';

===================================创建表
CREATE TABLE database_name.table_name

CREATE TABLE COMPANY(
   ID INT PRIMARY KEY     NOT NULL,
   NAME           TEXT    NOT NULL,
   AGE            INT     NOT NULL,
   ADDRESS        CHAR(50),
   SALARY         REAL
);
 .tables 命令来验证表是否已成功创建，该命令用于列出附加数据库中的所有表
 .schema 命令得到表的完整信息，如下所示：
 sqlite>.schema COMPANY

===================================删除表
DROP TABLE database_name.table_name;
DROP TABLE COMPANY;

===================================Insert 语句
INSERT INTO COMPANY (ID,NAME,AGE,ADDRESS,SALARY)
VALUES (1, 'Paul', 32, 'California', 20000.00 );
INSERT INTO COMPANY VALUES (7, 'James', 24, 'Houston', 10000.00 );

使用一个表来填充另一个表
INSERT INTO first_table_name [(column1, column2, ... columnN)] 
   SELECT column1, column2, ...columnN 
   FROM second_table_name
   [WHERE condition];

===================================Select 语句
SELECT column1, column2, columnN FROM table_name;
SELECT * FROM table_name;

sqlite>.header on
sqlite>.mode column
sqlite>.width 10, 20, 10
sqlite> SELECT * FROM COMPANY;

// Schema 信息
//  sqlite_master系统表
SELECT tbl_name FROM sqlite_master WHERE type = 'table';
SELECT sql FROM sqlite_master WHERE type = 'table' AND tbl_name = 'COMPANY';

===================================运算符
AND	AND 运算符允许在一个 SQL 语句的 WHERE 子句中的多个条件的存在。
BETWEEN	BETWEEN 运算符用于在给定最小值和最大值范围内的一系列值中搜索值。
EXISTS	EXISTS 运算符用于在满足一定条件的指定表中搜索行的存在。
IN	IN 运算符用于把某个值与一系列指定列表的值进行比较。
NOT IN	IN 运算符的对立面，用于把某个值与不在一系列指定列表的值进行比较。
LIKE	LIKE 运算符用于把某个值与使用通配符运算符的相似值进行比较。
GLOB	GLOB 运算符用于把某个值与使用通配符运算符的相似值进行比较。GLOB 与 LIKE 不同之处在于，它是大小写敏感的。
NOT	NOT 运算符是所用的逻辑运算符的对立面。比如 NOT EXISTS、NOT BETWEEN、NOT IN，等等。它是否定运算符。
OR	OR 运算符用于结合一个 SQL 语句的 WHERE 子句中的多个条件。
IS NULL	NULL 运算符用于把某个值与 NULL 值进行比较。
IS	IS 运算符与 = 相似。
IS NOT	IS NOT 运算符与 != 相似。
||	连接两个不同的字符串，得到一个新的字符串。
UNIQUE	UNIQUE 运算符搜索指定表中的每一行，确保唯一性（无重复）。

 以 'Ki' 开始的所有记录，'Ki' 之后的字符不做限制：
SELECT * FROM COMPANY WHERE NAME LIKE 'Ki%';
SELECT * FROM COMPANY WHERE NAME GLOB 'Ki*';

 AGE 的值为 25 或 27 的所有记录：
SELECT * FROM COMPANY WHERE AGE IN ( 25, 27 );

AGE 的值在 25 与 27 之间的所有记录：
sqlite> SELECT * FROM COMPANY WHERE AGE BETWEEN 25 AND 27;

SQL 子查询
子查询查找 SALARY > 65000 的带有 AGE 字段的所有记录，后边的 WHERE 子句与 EXISTS 运算符一起使用，列出了外查询中的 AGE 存在于子查询返回的结果中的所有记录：
SELECT AGE FROM COMPANY 
        WHERE EXISTS (SELECT AGE FROM COMPANY WHERE SALARY > 65000);

company
ID          NAME        AGE         ADDRESS     SALARY
----------  ----------  ----------  ----------  ----------
1           Paul        32          California  20000.0
2           Allen       25          Texas       15000.0
3           Teddy       23          Norway      20000.0
4           Mark        25          Rich-Mond   65000.0
5           David       27          Texas       85000.0
6           Kim         22          South-Hall  45000.0
7           James       24          Houston     10000.0
sqlite> SELECT * FROM COMPANY 
        WHERE AGE > (SELECT AGE FROM COMPANY WHERE SALARY > 65000);
ID          NAME        AGE         ADDRESS     SALARY
----------  ----------  ----------  ----------  ----------
1           Paul        32          California  20000.0

p	q	p & q	p | q
0	0	0	0
0	1	0	1
1	1	1	1
1	0	0	1

假设如果 A = 60，且 B = 13，现在以二进制格式，它们如下所示：
A = 0011 1100
B = 0000 1101
-----------------
A&B = 0000 1100
A|B = 0011 1101
~A  = 1100 0011

SELECT * FROM Persons WHERE (FirstName='Thomas' OR FirstName='William')
AND LastName='Carter'

===================================
日期表达式
SELECT CURRENT_TIMESTAMP;

数值表达式 eg:avg()、sum()、count()
SELECT COUNT(*) AS "RECORDS" FROM COMPANY; 
RECORDS = 7
SELECT (15 + 6) AS ADDITION
ADDITION = 21

===================================Update 语句
UPDATE COMPANY SET ADDRESS = 'Texas' WHERE ID = 6;
UPDATE COMPANY SET ADDRESS = 'Texas', SALARY = 20000.00;

===================================Delete 语句
DELETE FROM COMPANY;// DELETE * FROM COMPANY
DELETE FROM COMPANY WHERE ID = 7;

===================================Like 子句
百分号 （%）
下划线 （_）
百分号（%）代表零个、一个或多个数字或字符。
下划线（_）代表一个单一的数字或字符。这些符号可以被组合使用

===================================Glob 子句
与 LIKE 运算符不同的是，GLOB 是大小写敏感的，对于下面的通配符，它遵循 UNIX 的语法
星号 （*）
问号 （?）
星号（*）代表零个、一个或多个数字或字符。
问号（?）代表一个单一的数字或字符。这些符号可以被组合使用。

===================================Limit 子句
限制由 SELECT 语句返回的数据数量。
SELECT * FROM COMPANY LIMIT 6;
SELECT * FROM COMPANY LIMIT 3 OFFSET 2;// 从第三位开始提取 3 个记录：

===================================Order By 
默认升序
SELECT * FROM COMPANY ORDER BY SALARY ASC;//  升序排序
SELECT * FROM COMPANY ORDER BY NAME, SALARY ASC;

SELECT * FROM COMPANY ORDER BY NAME DESC;// 降序排序

===================================Group By
GROUP BY 子句放在 WHERE 子句之后，放在 ORDER BY 子句之前。

SELECT NAME, SUM(SALARY) FROM COMPANY GROUP BY NAME;

SELECT NAME, SUM(SALARY) FROM COMPANY GROUP BY NAME ORDER BY NAME;

===================================Having 子句
而 HAVING 子句则在由 GROUP BY 子句创建的分组上设置条件。
SELECT
FROM
WHERE
GROUP BY
HAVING
ORDER BY

SELECT * FROM COMPANY GROUP BY name HAVING count(name) < 2;

===================================Distinct 关键字
来消除所有重复的记录，并只获取唯一一次记录。
SELECT DISTINCT name FROM COMPANY;

===================================PRAGMA
可以用在 SQLite 环境内控制各种环境变量和状态标志。一个 PRAGMA 值可以被读取，也可以根据需求进行设置。

要查询当前的 PRAGMA 值，只需要提供该 pragma 的名字：
PRAGMA pragma_name;
要为 PRAGMA 设置一个新的值，语法如下：
PRAGMA pragma_name = value;

===================================约束
NOT NULL 约束：确保某列不能有 NULL 值。

DEFAULT 约束：当某列没有指定值时，为该列提供默认值。

UNIQUE 约束：确保某列中的所有值是不同的。

PRIMARY Key 约束：唯一标识数据库表中的各行/记录。

CHECK 约束：CHECK 约束确保某列中的所有值满足一定条件。

默认情况下，列可以保存 NULL 值
NULL 与没有数据是不一样的，它代表着未知的数据。

在一个表中可以有多个 UNIQUE 列，但只能有一个主键,主键是唯一的 ID。
我们使用主键来引用表中的行。可通过把主键设置为其他表的外键，来创建表之间的关系。
一个表只能有一个主键，它可以由一个或多个字段组成。当多个字段作为主键，它们被称为复合键。
如果一个表在任何字段上定义了一个主键，那么在这些字段上不能有两个记录具有相同的值。
主键是表中的一个字段，唯一标识数据库表中的各行/记录。主键必须包含唯一值。主键列不能有 NULL 值。

CREATE TABLE COMPANY(
   ID INT PRIMARY KEY     NOT NULL,
   NAME           TEXT    NOT NULL,
   AGE            INT     NOT NULL UNIQUE,
   ADDRESS        CHAR(50),
   SALARY         REAL    DEFAULT 50000.00// SALARY         REAL    CHECK(SALARY > 0)
);

===================================Join
COMPANY 表
ID          NAME        AGE         ADDRESS     SALARY
----------  ----------  ----------  ----------  ----------
1           Paul        32          California  20000.0
2           Allen       25          Texas       15000.0
3           Teddy       23          Norway      20000.0
4           Mark        25          Rich-Mond   65000.0
5           David       27          Texas       85000.0
6           Kim         22          South-Hall  45000.0
7           James       24          Houston     10000.0

DEPARTMENT 表
ID          DEPT        EMP_ID
----------  ----------  ----------
1           IT Billing  1
2           Engineerin  2
3           Finance     7

Join 子句用于结合两个或多个数据库中表的记录。JOIN 是一种通过共同值来结合两个表中字段的手段。
SQL 定义了三种主要类型的连接：
交叉连接 - CROSS JOIN
内连接 - INNER JOIN
外连接 - OUTER JOIN

交叉连接 - CROSS JOIN
交叉连接（CROSS JOIN）把第一个表的每一行与第二个表的每一行进行匹配。如果两个输入表分别有 x 和 y 行，则结果表有 x*y 行。由于交叉连接（CROSS JOIN）有可能产生非常大的表，使用时必须谨慎，只在适当的时候使用它们。
交叉连接的操作，它们都返回被连接的两个表所有数据行的笛卡尔积，返回到的数据行数等于第一个表中符合查询条件的数据行数乘以第二个表中符合查询条件的数据行数。
SELECT EMP_ID, NAME, DEPT FROM COMPANY CROSS JOIN DEPARTMENT;

内连接 - INNER JOIN
内连接（INNER JOIN）根据连接谓词结合两个表（table1 和 table2）的列值来创建一个新的结果表。查询会把 table1 中的每一行与 table2 中的每一行进行比较，找到所有满足连接谓词的行的匹配对。当满足连接谓词时，A 和 B 行的每个匹配对的列值会合并成一个结果行。
内连接（INNER JOIN）是最常见的连接类型，是默认的连接类型。INNER 关键字是可选的。
SELECT EMP_ID, NAME, DEPT FROM COMPANY INNER JOIN DEPARTMENT
        ON COMPANY.ID = DEPARTMENT.EMP_ID;

为了避免冗余，并保持较短的措辞，可以使用 USING 表达式声明内连接（INNER JOIN）条件。这个表达式指定一个或多个列的列表：
SELECT ... FROM table1 JOIN table2 USING ( column1 ,... ) ...
自然连接（NATURAL JOIN）类似于 JOIN...USING，只是它会自动测试存在两个表中的每一列的值之间相等值：
SELECT ... FROM table1 NATURAL JOIN table2...

外连接 - OUTER JOIN
外连接（OUTER JOIN）是内连接（INNER JOIN）的扩展。虽然 SQL 标准定义了三种类型的外连接：LEFT、RIGHT、FULL，但 SQLite 只支持 左外连接（LEFT OUTER JOIN）。
外连接（OUTER JOIN）声明条件的方法与内连接（INNER JOIN）是相同的，使用 ON、USING 或 NATURAL 关键字来表达。最初的结果表以相同的方式进行计算。一旦主连接计算完成，外连接（OUTER JOIN）将从一个或两个表中任何未连接的行合并进来，外连接的列使用 NULL 值，将它们附加到结果表中。

SELECT EMP_ID, NAME, DEPT FROM COMPANY LEFT OUTER JOIN DEPARTMENT
        ON COMPANY.ID = DEPARTMENT.EMP_ID;

===================================Unions 子句
UNION 子句/运算符用于合并两个或多个 SELECT 语句的结果，不返回任何重复的行。
为了使用 UNION，每个 SELECT 被选择的列数必须是相同的，相同数目的列表达式，相同的数据类型，并确保它们有相同的顺序，但它们不必具有相同的长度。

SELECT EMP_ID, NAME, DEPT FROM COMPANY INNER JOIN DEPARTMENT
        ON COMPANY.ID = DEPARTMENT.EMP_ID
   UNION
     SELECT EMP_ID, NAME, DEPT FROM COMPANY LEFT OUTER JOIN DEPARTMENT
        ON COMPANY.ID = DEPARTMENT.EMP_ID;


UNION ALL 运算符用于结合两个 SELECT 语句的结果，包括重复行。
适用于 UNION 的规则同样适用于 UNION ALL 运算符。
SELECT EMP_ID, NAME, DEPT FROM COMPANY INNER JOIN DEPARTMENT
        ON COMPANY.ID = DEPARTMENT.EMP_ID
   UNION ALL
     SELECT EMP_ID, NAME, DEPT FROM COMPANY LEFT OUTER JOIN DEPARTMENT
        ON COMPANY.ID = DEPARTMENT.EMP_ID;

===================================ALTER TABLE
ALTER TABLE 命令允许用户重命名表或向现有表添加一个新的列。
重命名列，删除一列，或从一个表中添加或删除约束都是不可能的。

===================================NULL 值
带有 NULL 值的字段是一个不带有值的字段。NULL 值与零值或包含空格的字段是不同的
UPDATE COMPANY SET ADDRESS = NULL, SALARY = NULL where ID IN(6,7);

===================================别名
您可以暂时把表或列重命名为另一个名字，这被称为别名
重命名是临时的改变，在数据库中实际的表的名称不会改变。
SELECT C.ID, C.NAME, C.AGE, D.DEPT
        FROM COMPANY AS C, DEPARTMENT AS D
        WHERE  C.ID = D.EMP_ID;

        别名的关键字 as 可以被省略

===================================Autoincrement（自动递增）
关键字 AUTOINCREMENT 只能用于整型（INTEGER）字段
CREATE TABLE COMPANY(
   ID INTEGER PRIMARY KEY   AUTOINCREMENT,
   NAME           TEXT      NOT NULL,
   AGE            INT       NOT NULL,
   ADDRESS        CHAR(50),
   SALARY         REAL
);

INSERT INTO COMPANY (NAME,AGE,ADDRESS,SALARY)
VALUES ( 'Paul', 32, 'California', 20000.00 );

===================================触发器（Trigger）
 触发器（Trigger）是数据库的回调函数，它会在指定的数据库事件发生时自动执行/调用
 SQLite 的触发器（Trigger）可以指定在特定的数据库表发生 DELETE、INSERT 或 UPDATE 时触发，或在一个或多个指定表的列发生更新时触发。

SQLite 只支持 FOR EACH ROW 触发器（Trigger），没有 FOR EACH STATEMENT 触发器（Trigger）。因此，明确指定 FOR EACH ROW 是可选的。

WHEN 子句和触发器（Trigger）动作可能访问使用表单 NEW.column-name 和 OLD.column-name 的引用插入、删除或更新的行元素，其中 column-name 是从与触发器关联的表的列的名称。

如果提供 WHEN 子句，则只针对 WHEN 子句为真的指定行执行 SQL 语句。如果没有提供 WHEN 子句，则针对所有行执行 SQL 语句。

BEFORE 或 AFTER 关键字决定何时执行触发器动作，决定是在关联行的插入、修改或删除之前或者之后执行触发器动作。

当触发器相关联的表删除时，自动删除触发器（Trigger）。

要修改的表必须存在于同一数据库中，作为触发器被附加的表或视图，且必须只使用 tablename，而不是 database.tablename。

一个特殊的 SQL 函数 RAISE() 可用于触发器程序内抛出异常。


创建 触发器（Trigger） 的基本语法如下：
CREATE  TRIGGER trigger_name [BEFORE|AFTER] event_name 
ON table_name
BEGIN
 -- Trigger logic goes here....
END;
在这里，event_name 可以是在所提到的表 table_name 上的 INSERT、DELETE 和 UPDATE 数据库操作。您可以在表名后选择指定 FOR EACH ROW。

以下是在 UPDATE 操作上在表的一个或多个指定列上创建触发器（Trigger）的语法：

CREATE  TRIGGER trigger_name [BEFORE|AFTER] UPDATE OF column_name 
ON table_name
BEGIN
 -- Trigger logic goes here....
END;



sqlite> CREATE TABLE COMPANY(
   ID INT PRIMARY KEY     NOT NULL,
   NAME           TEXT    NOT NULL,
   AGE            INT     NOT NULL,
   ADDRESS        CHAR(50),
   SALARY         REAL
);
我们将创建一个名为 AUDIT 的新表。每当 COMPANY 表中有一个新的记录项时，日志消息将被插入其中：
sqlite> CREATE TABLE AUDIT(
    EMP_ID INT NOT NULL,
    ENTRY_DATE TEXT NOT NULL
);
sqlite> CREATE TRIGGER audit_log AFTER INSERT 
ON COMPANY
BEGIN
   INSERT INTO AUDIT(EMP_ID, ENTRY_DATE) VALUES (new.ID, datetime('now'));
END;
我们将开始在 COMPANY 表中插入记录，这将导致在 AUDIT 表中创建一个审计日志记录



列出触发器（TRIGGERS）
您可以从 sqlite_master 表中列出所有触发器
SELECT name FROM sqlite_master
WHERE type = 'trigger';

SELECT name FROM sqlite_master
WHERE type = 'trigger' AND tbl_name = 'COMPANY';

删除触发器（TRIGGERS）
可用于删除已有的触发器：
sqlite> DROP TRIGGER trigger_name;


for each row 是操作语句每影响到一行的时候就触发一次，也就是删了 10 行就触发 10 次，而 for each state 一条操作语句就触发一次，有时没有被影响的行也执行。sqlite 只实现了 for each row 的触发。when 和 for each row 用法是这样的：

CREATE TRIGGER trigger_name 
AFTER UPDATE OF id ON table_1 
FOR EACH ROW 
WHEN new.id>30 
BEGIN 
UPDATE table_2 SET id=new.id WHERE table_2.id=old.id;
END;

===================================索引（Index）
索引（Index）是一种特殊的查找表，数据库搜索引擎用来加快数据检索。简单地说，索引是一个指向表中数据的指针。
索引有助于加快 SELECT 查询和 WHERE 子句，但它会减慢使用 UPDATE 和 INSERT 语句时的数据输入。索引可以创建或删除，但不会影响数据。
使用 CREATE INDEX 语句创建索引，它允许命名索引，指定表及要索引的一列或多列，并指示索引是升序排列还是降序排列。
索引也可以是唯一的，

CREATE INDEX 的基本语法如下：

CREATE INDEX index_name ON table_name;
单列索引
单列索引是一个只基于表的一个列上创建的索引。基本语法如下：

CREATE INDEX index_name
ON table_name (column_name);
唯一索引
使用唯一索引不仅是为了性能，同时也为了数据的完整性。唯一索引不允许任何重复的值插入到表中。基本语法如下：

CREATE UNIQUE INDEX index_name
on table_name (column_name);
组合索引
组合索引是基于一个表的两个或多个列上创建的索引。基本语法如下：

CREATE INDEX index_name
on table_name (column1, column2);
是否要创建一个单列索引还是组合索引，要考虑到您在作为查询过滤条件的 WHERE 子句中使用非常频繁的列。
如果值使用到一个列，则选择使用单列索引。如果在作为过滤的 WHERE 子句中有两个或多个列经常使用，则选择使用组合索引。

隐式索引
隐式索引是在创建对象时，由数据库服务器自动创建的索引。索引自动创建为主键约束和唯一约束。

在 COMPANY 表的 salary 列上创建一个索引：
sqlite> CREATE INDEX salary_index ON COMPANY (salary);
 .indices 命令列出 COMPANY 表上所有可用的索引，如下所示：
sqlite> .indices COMPANY
其中 sqlite_autoindex_COMPANY_1 是创建表时创建的隐式索引。
salary_index
sqlite_autoindex_COMPANY_1

SELECT * FROM sqlite_master WHERE type = 'index';

删除索引
sqlite> DROP INDEX salary_index;

虽然索引的目的在于提高数据库的性能，但这里有几个情况需要避免使用索引。使用索引时，应重新考虑下列准则：
索引不应该使用在较小的表上。
索引不应该使用在有频繁的大批量的更新或插入操作的表上。
索引不应该使用在含有大量的 NULL 值的列上。
索引不应该使用在频繁操作的列上。

===================================Indexed By
"INDEXED BY index-name" 子句规定必须需要命名的索引来查找前面表中值。
如果索引名 index-name 不存在或不能用于查询，然后 SQLite 语句的准备失败。
"NOT INDEXED" 子句规定当访问前面的表（包括由 UNIQUE 和 PRIMARY KEY 约束创建的隐式索引）时，没有使用索引。
然而，即使指定了 "NOT INDEXED"，INTEGER PRIMARY KEY 仍然可以被用于查找条目。

SELECT * FROM COMPANY INDEXED BY salary_index WHERE salary > 5000;

===================================Alter 命令
修改已有的表 重命名表和在已有的表中添加列
ALTER TABLE COMPANY RENAME TO OLD_COMPANY;
ALTER TABLE OLD_COMPANY ADD COLUMN SEX char(1);// 新添加的列是以 NULL 值来填充的。

===================================Truncate Table
在 SQLite 中，并没有 TRUNCATE TABLE 命令，但可以使用 SQLite 的 DELETE 命令从已有的表中删除全部的数据，
但建议使用 DROP TABLE 命令删除整个表，然后再重新创建一遍。

DELETE FROM table_name;// 如果您使用 DELETE TABLE 命令删除所有记录，建议使用 VACUUM 命令清除未使用的空间。
DROP TABLE table_name;

SQLite> DELETE FROM COMPANY;
SQLite> VACUUM;

===================================视图（View）
视图（View）实际上是一个以预定义的 SQLite 查询形式存在的表的组合。
视图（View）可以包含一个表的所有行或从一个或多个表选定行。视图（View）可以从一个或多个表创建，这取决于要创建视图的 SQLite 查询。、
视图（View）是一种虚表，允许用户实现以下几点：
用户或用户组查找结构数据的方式更自然或直观。
限制数据访问，用户只能看到有限的数据，而不是完整的表。
汇总各种表中的数据，用于生成报告。

CREATE VIEW COMPANY_VIEW AS
SELECT ID, NAME, AGE
FROM  COMPANY;
SELECT * FROM COMPANY_VIEW;

删除视图
DROP VIEW COMPANY_VIEW;

===================================事务（Transaction）
事务（Transaction）是一个对数据库执行工作单元。
事务（Transaction）是以逻辑顺序完成的工作单位或序列，可以是由用户手动操作完成，也可以是由某种数据库程序自动完成。
事务的属性:
事务（Transaction）具有以下四个标准属性，通常根据首字母缩写为 ACID：
原子性（Atomicity）：确保工作单位内的所有操作都成功完成，否则，事务会在出现故障时终止，之前的操作也会回滚到以前的状态。
一致性（Consistency)：确保数据库在成功提交的事务上正确地改变状态。
隔离性（Isolation）：使事务操作相互独立和透明。
持久性（Durability）：确保已提交事务的结果或效果在系统发生故障的情况下仍然存在。

例如，如果您正在创建一个记录或者更新一个记录或者从表中删除一个记录，那么您正在该表上执行事务。重要的是要控制事务以确保数据的完整性和处理数据库错误。

事务控制:
使用下面的命令来控制事务：
BEGIN TRANSACTION：开始事务处理。
COMMIT：保存更改，或者可以使用 END TRANSACTION 命令。
ROLLBACK：回滚所做的更改。
事务控制命令只与 DML 命令 INSERT、UPDATE 和 DELETE 一起使用。他们不能在创建表或删除表时使用，因为这些操作在数据库中是自动提交的。

事务（Transaction）可以使用 BEGIN TRANSACTION 命令或简单的 BEGIN 命令来启动。此类事务通常会持续执行下去，直到遇到下一个 COMMIT 或 ROLLBACK 命令。不过在数据库关闭或发生错误时，事务处理也会回滚。


COMMIT 命令是用于把事务调用的更改保存到数据库中的事务命令。
COMMIT 命令把自上次 COMMIT 或 ROLLBACK 命令以来的所有事务保存到数据库。
COMMIT;
or
END TRANSACTION;

ROLLBACK 命令
ROLLBACK 命令是用于撤消尚未保存到数据库的事务的事务命令。
ROLLBACK 命令只能用于撤销自上次发出 COMMIT 或 ROLLBACK 命令以来的事务。
ROLLBACK;

让我们开始一个事务，并从表中删除 age = 25 的记录，最后，我们使用 ROLLBACK 命令撤消所有的更改。
sqlite> BEGIN;
sqlite> DELETE FROM COMPANY WHERE AGE = 25;
sqlite> ROLLBACK;

让我们开始另一个事务，从表中删除 age = 25 的记录，最后我们使用 COMMIT 命令提交所有的更改。
sqlite> BEGIN;
sqlite> DELETE FROM COMPANY WHERE AGE = 25;
sqlite> COMMIT;

===================================子查询
子查询或内部查询或嵌套查询是在另一个 SQLite 查询内嵌入在 WHERE 子句中的查询。
使用子查询返回的数据将被用在主查询中作为条件，以进一步限制要检索的数据。
子查询可以与 SELECT、INSERT、UPDATE 和 DELETE 语句一起使用

以下是子查询必须遵循的几个规则：
子查询必须用括号括起来。
子查询在 SELECT 子句中只能有一个列，除非在主查询中有多列，与子查询的所选列进行比较。
ORDER BY 不能用在子查询中，虽然主查询可以使用 ORDER BY。可以在子查询中使用 GROUP BY，功能与 ORDER BY 相同。
子查询返回多于一行，只能与多值运算符一起使用，如 IN 运算符。
BETWEEN 运算符不能与子查询一起使用，但是，BETWEEN 可在子查询内使用。

SELECT * 
     FROM COMPANY 
     WHERE ID IN (SELECT ID 
                  FROM COMPANY 
                  WHERE SALARY > 45000) ;

INSERT INTO COMPANY_BKP
     SELECT * FROM COMPANY 
     WHERE ID IN (SELECT ID 
                  FROM COMPANY) ;

 UPDATE COMPANY
     SET SALARY = SALARY * 0.50
     WHERE AGE IN (SELECT AGE FROM COMPANY_BKP
                   WHERE AGE >= 27 );

 DELETE FROM COMPANY
     WHERE AGE IN (SELECT AGE FROM COMPANY_BKP
                   WHERE AGE > 27 );

===================================注入
如果您的站点允许用户通过网页输入，并将输入内容插入到 SQLite 数据库中，这个时候您就面临着一个被称为 SQL 注入的安全问题
注入通常在请求用户输入时发生，比如需要用户输入姓名，但用户却输入了一个 SQLite 语句，而这语句就会在不知不觉中在数据库上运行。

===================================Vacuum
VACUUM 命令通过复制主数据库中的内容到一个临时数据库文件，然后清空主数据库，并从副本中重新载入原始的数据库文件。这消除了空闲页，把表中的数据排列为连续的，另外会清理数据库文件结构。
如果表中没有明确的整型主键（INTEGER PRIMARY KEY），VACUUM 命令可能会改变表中条目的行 ID（ROWID）。VACUUM 命令只适用于主数据库，附加的数据库文件是不可能使用 VACUUM 命令。

手动 VACUUM
下面是在命令提示符中对整个数据库发出 VACUUM 命令的语法：
$sqlite3 database_name "VACUUM;"
您也可以在 SQLite 提示符中运行 VACUUM，如下所示：
sqlite> VACUUM;
您也可以在特定的表上运行 VACUUM，如下所示：
sqlite> VACUUM table_name;

自动 VACUUM（Auto-VACUUM）
SQLite 的 Auto-VACUUM 与 VACUUM 不大一样，它只是把空闲页移到数据库末尾，从而减小数据库大小。通过这样做，它可以明显地把数据库碎片化，而 VACUUM 则是反碎片化。所以 Auto-VACUUM 只会让数据库更小。
启用/禁用 SQLite 的 Auto-VACUUM：

sqlite> PRAGMA auto_vacuum = NONE;  -- 0 means disable auto vacuum
sqlite> PRAGMA auto_vacuum = INCREMENTAL;  -- 1 means enable incremental vacuum
sqlite> PRAGMA auto_vacuum = FULL;  -- 2 means enable full auto vacuum

您可以从命令提示符中运行下面的命令来检查 auto-vacuum 设置：
$sqlite3 database_name "PRAGMA auto_vacuum;"

===================================日期 & 时间
1	date(timestring, modifier, modifier, ...)	以 YYYY-MM-DD 格式返回日期。
2	time(timestring, modifier, modifier, ...)	以 HH:MM:SS 格式返回时间。
3	datetime(timestring, modifier, modifier, ...)	以 YYYY-MM-DD HH:MM:SS 格式返回。
4	julianday(timestring, modifier, modifier, ...)	这将返回从格林尼治时间的公元前 4714 年 11 月 24 日正午算起的天数。
5	strftime(format, timestring, modifier, modifier, ...)	这将根据第一个参数指定的格式字符串返回格式化的日期。具体格式见下边讲解。

1	YYYY-MM-DD	2010-12-30
2	YYYY-MM-DD HH:MM	2010-12-30 12:10
3	YYYY-MM-DD HH:MM:SS.SSS	2010-12-30 12:10:04.100
4	MM-DD-YYYY HH:MM	30-12-2010 12:10
5	HH:MM	12:10
6	YYYY-MM-DDTHH:MM	2010-12-30 12:10
7	HH:MM:SS	12:10:01
8	YYYYMMDD HHMMSS	20101230 121001
9	now	2013-05-07
您可以使用 "T" 作为分隔日期和时间的文字字符。

修饰符（Modifier）
NNN days

NNN hours

NNN minutes

NNN.NNNN seconds

NNN months

NNN years

start of month

start of year

start of day

weekday N

unixepoch

localtime

utc

格式化
SQLite 提供了非常方便的函数 strftime() 来格式化任何日期和时间。您可以使用以下的替换来格式化日期和时间：
%d	一月中的第几天，01-31
%f	带小数部分的秒，SS.SSS
%H	小时，00-23
%j	一年中的第几天，001-366
%J	儒略日数，DDDD.DDDD
%m	月，00-12
%M	分，00-59
%s	从 1970-01-01 算起的秒数
%S	秒，00-59
%w	一周中的第几天，0-6 (0 is Sunday)
%W	一年中的第几周，01-53
%Y	年，YYYY
%%	% symbol

当前日期：
SELECT date('now');

当前月份的最后一天：
sqlite> SELECT date('now','start of month','+1 month','-1 day');

给定 UNIX 时间戳 1092941466 的日期和时间：
sqlite> SELECT datetime(1092941466, 'unixepoch');
2004-08-19 18:51:06

计算给定 UNIX 时间戳 1092941466 相对本地时区的日期和时间：
sqlite> SELECT datetime(1092941466, 'unixepoch', 'localtime');
2004-08-19 11:51:06

当前的 UNIX 时间戳：
sqlite> SELECT strftime('%s','now');
1367926057

计算从 2004 年某一特定时刻以来的秒数：
sqlite> SELECT strftime('%s','now') - strftime('%s','2004-01-01 02:34:56');
295001572

计算当年 10 月的第一个星期二的日期：
sqlite> SELECT date('now','start of year','+9 months','weekday 2');
2013-10-01

在 UTC 与本地时间值之间进行转换，当格式化日期时，使用 utc 或 localtime 修饰符，如下所示：
sqlite> SELECT time('12:00', 'localtime');
05:00:00
sqlite>  SELECT time('12:00', 'utc');
19:00:00

===================================常用函数
所有函数都是大小写不敏感

1	SQLite COUNT 函数
SQLite COUNT 聚集函数是用来计算一个数据库表中的行数。
2	SQLite MAX 函数
SQLite MAX 聚合函数允许我们选择某列的最大值。
3	SQLite MIN 函数
SQLite MIN 聚合函数允许我们选择某列的最小值。
4	SQLite AVG 函数
SQLite AVG 聚合函数计算某列的平均值。
5	SQLite SUM 函数
SQLite SUM 聚合函数允许为一个数值列计算总和。
6	SQLite RANDOM 函数
SQLite RANDOM 函数返回一个介于 -9223372036854775808 和 +9223372036854775807 之间的伪随机整数。
7	SQLite ABS 函数
SQLite ABS 函数返回数值参数的绝对值。
8	SQLite UPPER 函数
SQLite UPPER 函数把字符串转换为大写字母。
9	SQLite LOWER 函数
SQLite LOWER 函数把字符串转换为小写字母。
10	SQLite LENGTH 函数
SQLite LENGTH 函数返回字符串的长度。
11	SQLite sqlite_version 函数
SQLite sqlite_version 函数返回 SQLite 库的版本。

SELECT count(*) FROM COMPANY;
SELECT max(salary) FROM COMPANY;
SELECT min(salary) FROM COMPANY;
SELECT avg(salary) FROM COMPANY;
SELECT sum(salary) FROM COMPANY;

SQLite RANDOM 函数返回一个介于 -9223372036854775808 和 +9223372036854775807 之间的伪随机整数。下面是实例：
sqlite> SELECT random() AS Random;

SELECT abs(5), abs(-15), abs(NULL), abs(0), abs("ABC");
abs(5)      abs(-15)    abs(NULL)   abs(0)      abs("ABC")
----------  ----------  ----------  ----------  ----------
5           15                      0           0.0

SELECT upper(name) FROM COMPANY;
SELECT lower(name) FROM COMPANY;
SELECT name, length(name) FROM COMPANY;// LENGTH 函数返回字符串的长度

SELECT sqlite_version() AS 'SQLite Version';

--------------------------##########--------------------------


===================================SQLite 索引（Index）
索引（Index）是一种特殊的查找表，数据库搜索引擎用来加快数据检索。简单地说，索引是一个指向表中数据的指针。
索引有助于加快 SELECT 查询和 WHERE 子句，但它会减慢使用 UPDATE 和 INSERT 语句时的数据输入。索引可以创建或删除，但不会影响数据。

使用 CREATE INDEX 语句创建索引，它允许命名索引，指定表及要索引的一列或多列，并指示索引是升序排列还是降序排列。
索引也可以是唯一的，与 UNIQUE 约束类似，在列上或列组合上防止重复条目。


索引不应该使用在较小的表上。
索引不应该使用在有频繁的大批量的更新或插入操作的表上。
索引不应该使用在含有大量的 NULL 值的列上。
索引不应该使用在频繁操作的列上。